{
  "schema_version": "knowledge-release-v2",
  "release_id": "KB-20260726-DUALDB-CONTRACT",
  "scope": "company",
  "generated_at": "2026-07-26T07:28:38.966Z",
  "source_path": "review/pending/KB-20260726-DUALDB-CONTRACT/source/35项核心制度指标完整提取.md",
  "source_sha256": "7e71f92e431a07b07d14aef34c66e116b706d5286b7e181d6b70bc837ac8ad8c",
  "generator_version": "build-wiki-v2",
  "model_id": "deterministic-adapter",
  "prompt_version": "knowledge-release-normalizer-v1",
  "prompt_sha256": "52a0288fc1c5af8b3cf50bfa029dba1da0424ca72679fcb916b65bd69c1c16ce",
  "counts": {
    "indicators": 35,
    "profiles": 45,
    "sql_blocks": 169
  },
  "files": {
    "index.md": "cae2cad3da52db9fd95c088c3840fdc4fbf108ab7ac2150ea8cb89b2256d43b2",
    "indexes/alias_index.json": "785187f48f59ee947f15a1b08a55b50e45ea5b49742bf7ff5e2006ee107c663e",
    "indexes/hospital_override_index.json": "6879f2ee9af511e8d3f0289ce338d20408466d6032f422d0d858581a0081dce2",
    "indexes/indicator_index.json": "c6d799760a0c842fcb9081437d98748968173681173d3698e4ad075de70926a1",
    "indexes/keyword_index.json": "0886e242779fdead5ea00dafef406a9c9a5352ca088c2078a70c5f86775933ec",
    "indexes/ngram_index.json": "66c3e207065b9bc3aceec9458b7ce975aff6fb5c1f2092226067e5c8571dc75a",
    "indexes/profile_index.json": "3c44fb619c62c8591fe7b4bf5a1c113dfc69871c38eaa1eb4a6eec2c23aaf969",
    "indexes/relation_index.json": "9af39b11f2467907ee8494dc099a8614e63e3ef9fc89f3028f3f26dc2415212a",
    "indexes/retrieval_cards.json": "d88db664973c4634cbbbe8bd497746ada4144d39690f37c252ee2605a41486ee",
    "indexes/rule_index.json": "22690a61f42cbdbeb3218c2686dddba3119919bae21641015815b5b5ae703241",
    "indexes/system_index.json": "256fba89f747c0a0e1b4e390f052350ad32fc8112374614336fcd2cd4165f3e1",
    "sql-correction-manifest.json": "d7ec268cab806971c47ba871d60140a4a8bd98a00186c98a0ba63cbb1bad7859",
    "sql-specs/HXZD-001-001/original/excel-original.md": "cc3fb7a42e955d76c6326d6471f16d7b871a91bb413f2215acacc3c36d3f2019",
    "sql-specs/HXZD-001-001/profiles/HXZD-001-001-company-default/department.sql": "c3fa5895d65f86b1e2a6a2bb433a89505ff9602b7d474309246f67f52a923cb5",
    "sql-specs/HXZD-001-001/profiles/HXZD-001-001-company-default/etl_source.sql": "a38a137584dd1ffd7362852f454200f12f23de0483be934f3845cbe122e628f3",
    "sql-specs/HXZD-001-001/profiles/HXZD-001-001-company-default/overview.sql": "4c9d6a15641b6720b208594b25f0f2569ebb9accc318a51cda084e7a124aa2d4",
    "sql-specs/HXZD-001-001/profiles/HXZD-001-001-company-default/patient_detail.sql": "e1e2cce73095b991cf0d81f7683b7df3663b2d37d59bf3222bf3400d907936b5",
    "sql-specs/HXZD-001-001/runtime.json": "a2e36fdc35f7073b4e87426f9d2b978cf4aad9b010be4fbe578539696ccf7ff4",
    "sql-specs/HXZD-001-001/sql-spec.md": "3efae2c7bd5c1fc1a42e73f629931142e78fd35325634e6edf2c5b32089dd90b",
    "sql-specs/HXZD-002-001/original/excel-original.md": "5a1bd56540a3383c796472e5c6f064e503ad40adde1679fc59f6eda5c879b5fd",
    "sql-specs/HXZD-002-001/profiles/HXZD-002-001-company-default/department.sql": "a75ce5448df92918072cce856b588f7c741af0398221b93ec72cba5d9895a637",
    "sql-specs/HXZD-002-001/profiles/HXZD-002-001-company-default/etl_source.sql": "6b955625160df197584c15e141b0839a20f74b31b9b80f3eed43140b12555b9e",
    "sql-specs/HXZD-002-001/profiles/HXZD-002-001-company-default/overview.sql": "8f3f3869f8f5735478f824c1d7d96903857e2535e95c3374629f27810ecf847e",
    "sql-specs/HXZD-002-001/profiles/HXZD-002-001-company-default/patient_detail.sql": "0d3be4b3360eb288ab0b9f023c5e452883853b95d36857c381f4bc0522046d9a",
    "sql-specs/HXZD-002-001/runtime.json": "8d98e1012994bc7d1db773dabdedf229b52ff8dbc6817e7aa080be741d30dd45",
    "sql-specs/HXZD-002-001/sql-spec.md": "93f3665ba5b2584a05d0755b909922fa3a732c43dfc5a1cc13fae8449cf0a67c",
    "sql-specs/HXZD-002-002/original/excel-original.md": "1e368afd913de7cce4b918ab9c2da13a4c550f02d7d78704e395162f36be1b05",
    "sql-specs/HXZD-002-002/profiles/HXZD-002-002-company-default/department.sql": "195d9a71036b4aa84809e626ec1f775282949bf65b15298882caebb80e3d754f",
    "sql-specs/HXZD-002-002/profiles/HXZD-002-002-company-default/etl_source.sql": "6b955625160df197584c15e141b0839a20f74b31b9b80f3eed43140b12555b9e",
    "sql-specs/HXZD-002-002/profiles/HXZD-002-002-company-default/overview.sql": "11dae15a4ac85b79d18b9f019b87ad4585f7e73374cbe6e7cfe50d7dce48ab16",
    "sql-specs/HXZD-002-002/profiles/HXZD-002-002-company-default/patient_detail.sql": "0d3be4b3360eb288ab0b9f023c5e452883853b95d36857c381f4bc0522046d9a",
    "sql-specs/HXZD-002-002/runtime.json": "65e8d7156433425de1c31abb9f24c91b8ba07505c65ef05c882067b65b115a15",
    "sql-specs/HXZD-002-002/sql-spec.md": "252153f5901e21629d0b962172fe1a2cd776f0ee1cec6293ce9cc19d5bf34178",
    "sql-specs/HXZD-002-003/original/excel-original.md": "2e2b0d930d3fd073a6f1b18871d07da00fd5d2ae4b97fe8161fb97f67cf3fad8",
    "sql-specs/HXZD-002-003/profiles/HXZD-002-003-company-default/department.sql": "0581ecd06a9f3844878fcd189e88bcbcfdbf6363a299f554b87f2ce9d6671fc0",
    "sql-specs/HXZD-002-003/profiles/HXZD-002-003-company-default/etl_source.sql": "6b955625160df197584c15e141b0839a20f74b31b9b80f3eed43140b12555b9e",
    "sql-specs/HXZD-002-003/profiles/HXZD-002-003-company-default/overview.sql": "24cbe2d8925ba48ea47b3e55f46e4dc624e09b1fa5ebb6431b7610d923e15ef1",
    "sql-specs/HXZD-002-003/profiles/HXZD-002-003-company-default/patient_detail.sql": "4c43f76a5f9f070a414cd3b767dd1552621bbf27433cb02801275479e2b846ab",
    "sql-specs/HXZD-002-003/runtime.json": "6b58fea9124d660dad2ee0fae63fe214368585264fdec528da57d8be5344aab0",
    "sql-specs/HXZD-002-003/sql-spec.md": "934d6cb4a99162d48be3ee618adffd0e65f04af2e61174733229879f875cdefa",
    "sql-specs/HXZD-003-001/original/excel-original.md": "236ff4221721f1d9f8d964e80b3fea790c76d5b81bc506233bf80e3039f18b1b",
    "sql-specs/HXZD-003-001/profiles/HXZD-003-001-company-default/department.sql": "a8f3440f8e788be3c9dc85e977b8cd4fd90e5466f7931ae5232a5c5b6a900299",
    "sql-specs/HXZD-003-001/profiles/HXZD-003-001-company-default/etl_source.sql": "8cdfb9d6d87af75a138e9bacf3dbe6518cb5b1a2e9b3d48ef7f7c90871e1049d",
    "sql-specs/HXZD-003-001/profiles/HXZD-003-001-company-default/overview.sql": "42eb47e82dc228fb6d8fdb8b4738306e57fa6aa19940220efd1d6855db426696",
    "sql-specs/HXZD-003-001/profiles/HXZD-003-001-company-default/patient_detail.sql": "29d849829b83ce001ec5b0546cb5af295930fea76ac0dcc597cc4b89fcf9db63",
    "sql-specs/HXZD-003-001/runtime.json": "c30d842c9331a14d1143a45b8b6382926806934424645f0cd4a77422a79626cc",
    "sql-specs/HXZD-003-001/sql-spec.md": "19f6fe5442181de4a6ac95ceb6e62ba5e7373823310b6f9e59194bee65cc5786",
    "sql-specs/HXZD-003-002/original/excel-original.md": "b2a1642cf6f00bd846bc80c1767ed34d0ecbf4373a2bba6cb804575936e73537",
    "sql-specs/HXZD-003-002/profiles/HXZD-003-002-company-default/department.sql": "fe75a17b3cc5e0882d9c86e998f64d069adadc06a0ffd55d9732818aeae984d6",
    "sql-specs/HXZD-003-002/profiles/HXZD-003-002-company-default/etl_source.sql": "8cdfb9d6d87af75a138e9bacf3dbe6518cb5b1a2e9b3d48ef7f7c90871e1049d",
    "sql-specs/HXZD-003-002/profiles/HXZD-003-002-company-default/overview.sql": "2c54dd5679771865149daf89722290616e50a576f009f219ba29fd2d1c7d4cde",
    "sql-specs/HXZD-003-002/profiles/HXZD-003-002-company-default/patient_detail.sql": "1239b99d5db849c2c0e185bf93a44c27b20be4a942b0f1dc51da291b9110607d",
    "sql-specs/HXZD-003-002/runtime.json": "087d7798ecd4cd6825e080394a2f1aab034b8fbaac1e7aa0bcfc1e0788047440",
    "sql-specs/HXZD-003-002/sql-spec.md": "36285bbebe030849dcbafe51b4288370e0d8f414c83c783a93c49c7bcbdf19ff",
    "sql-specs/HXZD-003-003/original/excel-original.md": "4f6129ce0f3b58d525b6a5505f6b00c5b97e1565190d464f29f6c27ecbdea781",
    "sql-specs/HXZD-003-003/profiles/HXZD-003-003-company-candidate-01/department.sql": "9614b3eb1734a18cb421ac81ca2afb0f8fbb8869b58e1474a7413bb985e13598",
    "sql-specs/HXZD-003-003/profiles/HXZD-003-003-company-candidate-01/etl_source.sql": "ed1a6af2df972b4a6ff2f5eee060b17cca5c64a490a25186a868988efd5c378e",
    "sql-specs/HXZD-003-003/profiles/HXZD-003-003-company-candidate-01/overview.sql": "c4ffd3067e59831464af005f142589318dd1a91064506cde93b7b052e5f9e6e7",
    "sql-specs/HXZD-003-003/profiles/HXZD-003-003-company-candidate-01/patient_detail.sql": "a5ecf28f5b1a6aa9aa966813ad3104d213eb4dc9d21452edaf0f394b5116ca4d",
    "sql-specs/HXZD-003-003/profiles/HXZD-003-003-company-default/department.sql": "9614b3eb1734a18cb421ac81ca2afb0f8fbb8869b58e1474a7413bb985e13598",
    "sql-specs/HXZD-003-003/profiles/HXZD-003-003-company-default/etl_source.sql": "ed1a6af2df972b4a6ff2f5eee060b17cca5c64a490a25186a868988efd5c378e",
    "sql-specs/HXZD-003-003/profiles/HXZD-003-003-company-default/overview.sql": "c4ffd3067e59831464af005f142589318dd1a91064506cde93b7b052e5f9e6e7",
    "sql-specs/HXZD-003-003/profiles/HXZD-003-003-company-default/patient_detail.sql": "a5ecf28f5b1a6aa9aa966813ad3104d213eb4dc9d21452edaf0f394b5116ca4d",
    "sql-specs/HXZD-003-003/runtime.json": "dc7ea746aa33ce985acf458a88c1f5682c344fae22385defed2e7fe5f303efbf",
    "sql-specs/HXZD-003-003/sql-spec.md": "5b0d101a5a4e07586d960d5e8aec2721ec03fca1dc441ee2182b08a1895ab2d8",
    "sql-specs/HXZD-003-004/original/excel-original.md": "21b151a2b6a0acc030f53cfecf94799feca04bbea13edb3a866ca62d141132c0",
    "sql-specs/HXZD-003-004/profiles/HXZD-003-004-company-default/department.sql": "70d20ad30e520b72a8234cd97486d3262d839c989e80ed274bd99bd1693fcdc8",
    "sql-specs/HXZD-003-004/profiles/HXZD-003-004-company-default/etl_source.sql": "ed1a6af2df972b4a6ff2f5eee060b17cca5c64a490a25186a868988efd5c378e",
    "sql-specs/HXZD-003-004/profiles/HXZD-003-004-company-default/overview.sql": "c5508a092e73b111354e38641ba67a97e44abf45f34c7117e177312ce180a8df",
    "sql-specs/HXZD-003-004/profiles/HXZD-003-004-company-default/patient_detail.sql": "da55825972ed51072f085115c4fea417fb7603dfb2da98ce517337f13282dab5",
    "sql-specs/HXZD-003-004/runtime.json": "92920250c18db2db83734d318c373af28a9086ef850e63f8025f4e4dee55e33b",